{
  "device_id": "dev-test-1",
  "account_id": "acct-test-1",
  "pubkey_ed25519": "PLACEHOLDER_PUBLIC_KEY_BASE64URL",
  "issued_at": "2025-09-01T12:00:00Z",
  "expires_at": "2027-09-01T12:00:00Z",
  "sig": "PLACEHOLDER_SIGNATURE_BASE64URL",
  "meta": { "os": "linux", "name": "alice-laptop", "client_version": "1.0.0" }
}
